id,text
0,"Readiness Assessment for AI Driven Transformation Vector's AIOPS Readiness Assessment is designed to help businesses evaluate their current IT operations and identify opportunities for leveraging artificial intelligence and machine learning to drive operational excellence Our tool driven assessment provides a strategic roadmap for implementing AIOPS within your organization, enabling you to harness the power of AI-driven insights, automation, and intelligent decision-making. By undergoing this assessment, you'll gain a deep understanding of your IT ecosystem, identify areas for improvement, and receive actionable recommendations to transform your IT operations. Our assessment examines the following key components across your IT Landscape SYSTEMS OF INSIGHTS Evaluate your organization's ability to derive insights from historical data and predict future trends. Assess the maturity of your data analytics capabilities and identify areas for improvement. SYSTEMS OF ENGAGEMENT Review your current user interfaces, chatbots, voice bots, collaboration tools, and communication channels. Identify opportunities to enhance user experience and streamline interactions through AI-powered interfaces. SYSTEMS OF INTELLIGENCE Assess your organization's adoption of artificial intelligence (AI), machine learning (ML), natural language understanding (NLU), and natural language processing (NLP) technologies. Evaluate the maturity of your AI/ML models and identify areas for optimization and enhancement. SYSTEMS OF ACTION Examine your existing provisioning, orchestration, metering, log parsing, and automation systems. Identify gaps and recommend improvements to streamline IT operations and enable proactive issue resolution. SYSTEMS OF RECORDS Review your IT Service Management (ITSM) systems and processes. Assess the integration readiness of your ITSM systems with AI-powered automation and analytics tools. SYSTEMS OF ASSURANCE Evaluate your current system, application, and network monitoring capabilities. Assess the effectiveness of your threat detection and correlation engines. Identify opportunities to enhance monitoring and security through AI-driven insights. TSM PROCESSES Review your incident, problem, event, and service request management processes. Identify areas where AI and automation can be leveraged to improve efficiency and reduce mean time to resolution (MTTR). OPERATIONS MODEL Access the collaboration and communication channels between internal and external support teams. Identify opportunities to optimize team structures and processes for effective AIOPS adoption. APPLICATIONS Evaluate the performance, scalability, and reliability of your critical applications. Assess the readiness of your applications for integration with AI-powered monitoring and analytics tools. INFRASTRUCTURE Review your current IT infrastructure landscape, including servers, networks and storage systems. Identify areas for optimization and recommend strategies for leveraging AI-driven insights to improve infrastructure performance and reliability."
1,"3 week plan for the Readiness Assessment WEEK 1 ASSESSMENT KICKOFF AND DISCOVERY Assess current state of IT operations across ten key areas Review existing documentation and IT landscape Interview key stakeholders and IT teams WEEK 2 ANALYSIS AND STRATEGY DEVELOPMENT Evaluate readiness for AIOPS adoption Develop a high-level AIOPS architecture and integration plan Define KPIs and success metrics for AIOPS implementation Create a prioritized list of use cases and quick wins Develop a phased AIOPS implementation roadmap WEEK 3 RECOMMENDATIONS AND ROADMAP PRESENTATION Create a high-level business case and ROI projections Present findings, recommendations, and the implementation roadmap to stakeholders Establish next steps and timelines for AIOPS adoption Key Outcomes of Vector's Readiness Assessment IT STRATEGY &FINANCIAL ROADMAP Actionable, phased roadmap for AIOPS implementation and Total Cost of Ownership analysis (TCO) TECHNOLOGY RECOMMENDATIONS. Recommendations for integrating or replacing existing tools with AI-powered solutions to enable intelligent automation and predictive analytics PROCESS OPTIMIZATION Identification of process inefficiencies and recommendations for streamlining ITSM processes through AI-driven automation. PROOF OF CONCEPT (POC) PLAN Customized POC plan to demonstrate the value of Vector's AIOPS platform in your specific IT environment. By undergoing AIOPS Readiness Assessment, your organization will gain a clear understanding of its preparedness for AIOPS adoption, receive actionable recommendations to guide your transformation journey, and be well-positioned to harness the power of AI-driven IT operations for improved efficiency, reliability and business outcomes."
2,"Proof of Concept (POC) Overview Application Performance Management (APM) OBJECTIVE The objective of this POC is to demonstrate the value and effectiveness of Vector's Application Performance Management (APM) module. The POC aims to showcase how the APM module can provide end-to-end visibility into application performance, identify bottle necks, and optimize application delivery within a 3-week timeframe. POC Sizing APPLICATION SELECTION Choose 2-3 business-critical applications that span various technologies (e.g., web, mobile, databases) and have a significant impact on business operations. USER BASE Include a representative sample of end-users accessing the selected applications, covering different user roles, geographies, and peak usage times. TRANSACTION VOLUME Ensure that the selected applications have a sufficient transaction volume to evaluate the APM module's ability to handle real-world workloads. INFRASTRUCTURE Include the underlying infrastructure components supporting the selected applications, such as servers, databases, and network devices. POC Timeline WEEK 1 PLANNING AND INSTALLATION Identify the specific applications and infrastructure components for the POC. Define success criteria and key performance indicators (KPIs). Install and configure Vector's APM module in the designated environment. WEEK 2 DATA COLLECTION AND SCENARIO TESTING Instrument the selected applications with Vector's APM agents. Collect application performance data, including response times, error rates, and resource utilization. Conduct a series of pre-defined test scenarios to evaluate the APM module's capabilities, including end-to-end transaction tracing, anomaly detection, and performance optimization. WEEK 3 RESULTS ANALYSIS AND PRESENTATION Analyze the POC results and compare them against the defined success criteria. Prepare a comprehensive report highlighting the key findings, benefits, and ROI of the APM module. Present the POC results to stakeholders and gather feedback."
3,"Target Metrics for Vector Platform APPLICATION AVAILABILITY Measure the uptime and availability of the selected applications during the POC period. Target: Achieve application availability of 99.9% or higher. APPLICATION RESPONSE TIME Monitor the end-to-end response times for critical transactions and user journeys. Target: Reduce average response times by 30% compared to the baseline ERROR DETECTION AND TROUBLESHOOTING Evaluate the effectiveness of Vector's APM module in detecting application errors and exceptions. Target: Identify and troubleshoot 100% of the critical application errors during the POC period. RESOURCE UTILIZATION Monitor the resource utilization (e.g., CPU, memory) of the application infrastructure. Target: Optimize resource utilization and identify opportunities for cost savings USER EXPERIENCE Measure the impact of application performance on end-user experience using metrics like Apdex score or user satisfaction surveys. Target: Achieve an Apdex score of 0.9 or higher, indicating excellent user experience Success Criteria THE POC WILL BE CONSIDERED SUCCESSFUL IF THE FOLLOWING CRITERIA ARE MET Vector's APM module provides comprehensive visibility into the performance of the selected applications. The APM module effectively identifies performance bottlenecks, errors, and anomalies inreal-time. Application response times and resource utilization are optimized, leading to improved user experience. The APM module enables proactive identification and troubleshooting of application issues before they impact end-users. The APM module offers custom dashboards for CIOs, Infra heads, and support teams. It integrates seamlessly with Jira, ServiceNow, OpsGenie, and Microsoft Teams, streamlining communication and workflow management. By conducting this focused 3-week POC, we aim to validate the capabilities and benefits of Vector's Application Performance Management module in the context of your critical business applications. The POC will provide valuable insights into how the APM module can help optimize application performance, improve user experience, and drive business value through proactive application management."
4,"Empowering Your AI Journey for Intelligent IT Operations What is the problem we are solving Achieving a Single Source of Truth Consolidate 3 discreet IT tools into a unified platform Centralized, reliable, and accurate view of IT operations Enable cross-functional collaboration between disparate IT teams Shift ITOPS from tool-centric to metrics-driven Focus on business outcomes and customer KPIs, not just the tools Leveraging new Tech through AI and ML for higher automation Aligning Customer Metrics with IT Metrics and KPIs Bridge the gap between IT performance and customer experience Identifying and tracking customer-centric metrics and KPIs Correlating IT metrics with customer satisfaction, loyalty, and revenue The Solution : Vector Unified Operations FOUNDATIONAL LAYER Unified Observability & Data Storage GRAFANA Operational Telemetry, Logs, Metrics, Configs OPEN SEARCH Centralized Log and Alert Ingestion Event Correlation and Enrichment Real-time Monitoring and Alerting Anomaly Detection and Root Cause Analysis INFRASTRUCTURE PERFORMANCE Comprehensive Coverage with Agent and Agentless Monitoring Automated Remediation and Runbook Automation End-to-End Infrastructure Dependency Mapping Advanced Network Performance Monitoring and Traffic Analysis APPLICATION PERFORMANCE Real User Monitoring (RUM) and User Behavior Monitoring Application Performance Baselining and Optimization Recommendations Mobile App Performance Monitoring and Browser Session Monitoring  Synthetic Monitoring - Visual Replay of User Sessions and Latency Display SECURITY & COMPLIANCE Endpoint Detection and Response (EDR) User and Entity Behavior Analytics (UEBA) Compliance Monitoring and Reporting Continuous Security Monitoring and Alerting"
5,"Platform Features Integrations and Security, Scalable Architecture, Cloud-native and containerized deployment options, Elastic scalability to handle growing data volumes and workloads, Seamless integration with existing IT infrastructure and tools, Secure by Design, Built-in security controls and best practices, Regularly audited and penetration tested Compliance with industry standards (e.g., ISO 27001, SOC 2) Access Management Role-based access control (RBAC) for granular permissions Multi-factor authentication (MFA) for enhanced security Audit trails and activity logging for accountability Integrations MONITORING AND OBSERVABILITY 1.Zabbix 2.Prometheus 3.Grafana 4.Sensu 5.Nagios 6.ELK Stack 7.Icinga 8.Site 24*7 9.Security 10.WazuhITSM AND INCIDENT MANAGEMENT 1.Jira 2.PagerDutyDATA INTEGRATION AND ETL 1.Ansible 2.Apache Camel 3.Hevo Data 4.Apache Kafka 5.Logstash 6.Jaspersoft 7.Talend 8.KETL 9.Apache NiFi 10.Apache Flume 11.SnowFlake 12.DataBricks AI AND MACHINE LEARNING 1.PyTorch 2.Keras 3.TensorFlow 4.MLflow 5.OpenAI 6.Anthropic 7.Gemini"
6,"Pricing STARTUP UNIFIED MONITORING STARTING AT 50 CENTS/MO UPTO 1,000 HOSTS INFRASTRCUTURE 24*7 Monitoring, Monitor uptime SLAs and SLOs, Agent and Agentless monitoring, Dashboard customization APPLICATION PERFORMANCE Synthetic Monitoring, Monitor uptime SLAs and SLOs, Log monitoring and Analytics, Dashboard customization SECURITY & COMPLIANCE24*7 Monitoring, Vulnerability Detection, Malware detection RECOMMENDED ENTERPRISE INCLUDES UNIFIED MONITORING UNIFIED REMEDIATION STARTING AT $2100/MO UPTO 1,000 HOSTS INFRASTRCUTURE Device state management, Network traffic analysis, Capacity Monitoring, Runbook Automation APPLICATION PERFORMANCE Service dependency visualizations, Browser Session Monitoring, User Behavior monitoring, Latency display of DNS, SSL, TTFB SECURITY & COMPLIANCE Security Log Analysis, Alerts embedded with MITRE ATT&CK Out-of-box detection rule ADVANCE DS INCLUDES UNIFIED MONITORING + UNIFIED REMEDIATION + AIOPS CUSTOM ENGINEERING INFRASTRCUTURE Predictive Analysis, AI-driven insights, Automated Remediation, Root cause analysis APPLICATION PERFORMANCE Anomaly detection, Business transaction monitoring, Service map with correlated data, metrics and logs, Visual replay of user session SECURITY & COMPLIANCE Security Configuration Assessment (SCA), CIS Benchmark assessment"
7,"Unique Value Proposition The Unified Observability Module is a key component of the Vector platform that integrates logs and alerts from various monitoring, application performance, and security tools. It provides a centralized view of the IT environment, enabling advanced analytics, event correlations, and AI-driven insights KEY FEATURES Centralized Log and Alert Ingestion Event Correlation and Enrichment Real-time Monitoring and Alerting Anomaly Detection and Root Cause Analysis KEY METRICS Number of logs and alerts ingested per second Correlation accuracy (percentage of correctly correlated events) Alert detection time Anomaly detection accuracy (percentage of true anomalies detected) Next Steps Schedule Demo Schedule a personalized demo tailored to your specific needs 2 Week Readiness Assessment Current Pain Points IT Spend Analysis Future State Plan 3 Week Proof of Concept Select Network or Applications based on your pain points Experience Vector in your own environment Zero Risk Trial Flexible licensing options for different deployment scenarios Set up a parallel deployment with your current tools with a no obligation trial"
8,"Contact : WEBSITE - www.deployvector.com MAIL- info@deployvector.com CONTACT - +1 (844) 824 6686 LOCATIONS - . Atlanta . Chicago . Washington DC . Dubai. Pune . Ahmedabad . Singapore Customer Support 24/7 technical support via phone, email, and chat Dedicated account manager for personalized assistance Comprehensive documentation and knowledge base Regular software updates and enhancements"
9,"Transforming IT Operations with the Power of AI Vector is a unified AIOps platform that transforms IT operations by leveraging the power of AI and machine learning. It seamlessly integrates with existing foundational tools across infrastructure, application, and security to provide a centralized, reliable, and accurate view of IT operations. Vector empowers organizations to embark on their AI journey, enabling them to proactively identify and resolve issues, optimize performance, and align IT operations with business objectives. Key Platform Features UNIFIED DATA INTEGRATION Seamlessly integrates with existing tools and systems, Unifies data from disparate sources into a single source of truth INTELLIGENT AUTOMATION Automates routine tasks and workflows, Provides intelligent recommendations for issue resolution and optimization AI-DRIVEN INSIGHTS Leverages AI and machine learning algorithms for advanced analytics, Provides real-time anomaly detection and predictive maintenance CUSTOMIZABLE DASHBOARDS AND REPORTING Offers intuitive, customizable dashboards for real-time monitoring, Provides comprehensive reporting and analytics capabilities Unified Observability Module The Unified Observability Module is a key component of the Vector platform that integrates logs and alerts from various monitoring, application performance, and security tools. It provides a centralized view of the IT environment, enabling advanced analytics, event correlation, and AI-driven insights. KEY FEATURES Centralized Log and Alert Ingestion Event Correlation and Enrichment Real-time Monitoring and Alerting Anomaly Detection and Root Cause Analysis KEY METRICS Number of logs and alerts ingested per second Correlation accuracy (percentage of correctly correlated events) Alert detection time Anomaly detection accuracy ( percentage of true anomalies detected )"
10,"Application Performance Monitoring (APM) Module. The APM Module provides end-to-end visibility into application performance, user experience, and business transactions. It leverages AI-powered analytics to identify performance bottlenecks, anomalies and optimization opportunities KEY FEATURES Real User Monitoring (RUM) and User Behavior Monitoring AI-Powered Root Cause Analysis and Anomaly Detection Service Dependency Visualization and Distributed Tracing Aerts, Notifications, and Synthetic Monitoring KEY METRICS Application Availability ( Target: 99.9% or higher ) Application Response Time ( Target: Depends on the application, but typically < 500ms ) User Satisfaction ( Target : Apdex score of 0.8 or higher ) Mean Time to Detect (MTTD) (Target: Minimize through proactive monitoring and AI-driven insights) Infrastructure Performance Monitoring (IPM) Module The IPM Module provides comprehensive monitoring and analytics for IT infrastructure, including servers, networks, and storage. It leverages AI-driven insights to optimize infrastructure performance, capacity, and availability. KEY FEATURES Comprehensive Coverage with Agent and Agentless Monitoring AI-Driven Root Cause Analysis and Intelligent Insights Predictive Analytics and Anomaly Detection Automated Remediation and Runbook Automation KEY METRICS Infrastructure Availability (Target: 99.9% or higher) CPU Utilization (Target: Typically < 80% for optimal performance) Network Performance (Target: Depends on the network infrastructure and requirements)Infrastructure MTTD and MTTR (Target: Minimize through proactive monitoring and automated remediation)"
11,"Security and Compliance Monitoring (SCM) Module The SCM Module provides advanced security monitoring, threat detection, and compliance management capabilities. It leverages AI and behavioral analytics to identify and respond to security incidents proactively. KEY FEATURES Advanced Threat Detection and Response User and Entity Behavior Analytics (UEBA) Security Orchestration, Automation, and Response (SOAR) Compliance Monitoring and Reporting KEY METRICS Security Incident Detection Rate (Target: Maximize true positives and minimize false positives)Mean Time to Detect (MTTD) (Target: Minimize through AI-driven threat detection and alerting)Mean Time to Respond (MTTR) (Target: Minimize through automated playbooks and guided response recommendations)Compliance with Security Standards (Target: Maintain compliance and identify areas for improvement)The Vector platform, with its integrated modules for Unified Observability, APM, IPM, and SCM, provides a comprehensive and AI-driven solution for transforming IT operations. By leveraging the power of AI and machine learning, Vector enables organizations to proactively monitor, optimize, and secure their IT environments, driving improved performance, availability, and alignment with business objectives Integration integrates with popular tools like Zabbix, Prometheus, Grafana, and Wazuh Supports a wide range of data sources and formats Compatible with cloud, on-premises, and hybrid IT environments Enterprise-Grade Security Vector ensures secure data transmission and storage with encryption Role-based access control (RBAC) for granular user permissions Compliance with industry standards (e.g., ISO 27001, SOC 2)Regular security audits and penetration testing"
12,"Bitcoin is more stable than it's been in years, and the next halving is fast approaching. Taking current market conditions into account, now might well be the perfect time to invest, so long as you remain cognizant of the risks. But if you opt to jump into the market … what comes next"